{
  "api_version": "legado.harness/v1",
  "kind": "WorkItem",
  "metadata": {
    "id": "IOS-BUSINESS-KNOWLEDGE-PUBLISHER-AUTO-SCOPE-001",
    "labels": [
      "phase-0",
      "control-plane",
      "business-knowledge-publisher-auto-scope",
      "automation-policy",
      "corrective"
    ],
    "priority": 100,
    "risk": "high",
    "title": "建立无人工 Gate 的业务知识发布精确自动边界"
  },
  "spec": {
    "acceptance": {
      "criteria": [
        {
          "id": "AC-1",
          "knowledge_claims": [],
          "requirement_clauses": [],
          "statement": "新增专用 business-knowledge publisher automation scope validator；触发标签、控制模式、无 Gate 和 completion effect 约束必须精确，不能与 Golden/Oracle 例外混用。",
          "verified_by": [
            "harness-tests"
          ]
        },
        {
          "id": "AC-2",
          "knowledge_claims": [],
          "requirement_clauses": [],
          "statement": "未来实现项 allow_write 必须与固定 Workflow、staging Publisher、专用 Dispatcher、Demand/Supervisor、配置、对应测试/README、Capability/Checkpoint/Pitfall 完全相等；缺少、增加、通配或类型异常均 fail closed。",
          "verified_by": [
            "harness-tests"
          ]
        },
        {
          "id": "AC-3",
          "knowledge_claims": [],
          "requirement_clauses": [],
          "statement": "拒绝回归覆盖其他 Workflow、Android/Golden/Oracle/SourceLab、Requirement、ADR、Package、产品、published/coverage/release authority、Harness schema/config 和审批路径。",
          "verified_by": [
            "dependency-policy",
            "harness-tests"
          ]
        },
        {
          "id": "AC-4",
          "knowledge_claims": [],
          "requirement_clauses": [],
          "statement": "本项不修改 Workflow、Publisher、Dispatcher、DemandCompiler、配置或任何知识 authority；仅建立后续自动实现边界并沉淀下一步。",
          "verified_by": [
            "dependency-policy",
            "memory-close"
          ]
        }
      ],
      "required_checks": [
        "dependency-policy",
        "harness-tests"
      ]
    },
    "architecture_refs": [
      "ADR-0002",
      "ADR-0004"
    ],
    "baseline_checks": [
      "dependency-policy",
      "harness-tests"
    ],
    "budget": {
      "max_edit_verify_cycles": 5,
      "max_full_test_runs": 3,
      "max_infra_retries": 1,
      "max_targeted_test_runs": 16,
      "wall_clock_seconds": 10800
    },
    "capability": "CAP-KNOWLEDGE-CONTROL",
    "completion_effects": {
      "health": {
        "business_knowledge_publisher_auto_scope": "exact_paths_v1"
      }
    },
    "depends_on": [
      "IOS-KNOWLEDGE-SOURCE-RUNTIME-POST-FORM-001"
    ],
    "gates": [],
    "inputs": {
      "android_source_anchors": [],
      "context_files": [
        "ios/harness/loop_supervisor.py",
        "ios/harness/tests/test_loop_supervisor.py",
        "ios/project/checkpoints/IOS-KNOWLEDGE-SOURCE-RUNTIME-POST-FORM-001.json",
        ".github/workflows/business-knowledge-publisher.yml",
        "ios/publisher/business_knowledge_publisher.py",
        "ios/harness/github_golden_publisher.py"
      ],
      "fixtures": []
    },
    "intent": "为下一项无人工 Gate Business Knowledge Publisher 自动化预声明不可扩张的精确修改集合。在 LoopSupervisor 增加独立 scope validator：只有同时携带 external-execution、business-knowledge、knowledge-publisher、corrective 标签，且 gates 为空、requirements=control_plane、knowledge/source_lab=not_applicable、completion_effects 仅 health 的 WorkItem 才能进入此例外；allow_write 必须与固定 Workflow、staging Publisher、专用 Dispatcher、Demand/Supervisor、supervisor 配置、对应测试/README 和记忆文件集合完全相等。显式回归必须拒绝其他 Workflow、Android/Golden/Oracle/SourceLab、Requirement、ADR、Package、产品、published/coverage/release authority、Harness schema/config 与审批路径。此项不实现 Publisher、不修改 Workflow、不发布知识。",
    "knowledge": {
      "claim_refs": [],
      "context_budget": {
        "max_bytes": 16384,
        "max_claims": 1
      },
      "contract_version": 1,
      "coverage_refs": [],
      "driver_refs": [],
      "expected_ledger_transitions": [],
      "mode": "not_applicable",
      "none_reason": "本项只建立自动修改范围，不消费或发布业务知识",
      "produces": []
    },
    "memory": {
      "adr": "not_required",
      "capability_state_required": true,
      "checkpoint_required": true,
      "pitfall": "if_non_obvious_and_preventable"
    },
    "requirements": {
      "mode": "control_plane",
      "none_reason": "本项只建立 Loop 自动修改策略边界，不改变产品 Requirement",
      "refs": []
    },
    "scope": {
      "allow_write": [
        "ios/harness/loop_supervisor.py",
        "ios/harness/tests/test_loop_supervisor.py",
        "ios/harness/README.md",
        "ios/project/capabilities/CAP-KNOWLEDGE-CONTROL.json",
        "ios/project/checkpoints/IOS-BUSINESS-KNOWLEDGE-PUBLISHER-AUTO-SCOPE-001.json",
        "ios/project/pitfalls/PIT-*.json"
      ],
      "deny_write": [
        ".github/**",
        "app/**",
        "modules/**",
        "ios/Packages/**",
        "ios/publisher/**",
        "ios/harness/demand_compiler.py",
        "ios/harness/github_business_knowledge_publisher.py",
        "ios/harness/harness.py",
        "ios/harness/config.json",
        "ios/harness/schemas/**",
        "ios/harness/business-knowledge/**",
        "ios/harness/goldens/**",
        "ios/harness/oracle/**",
        "ios/harness/source-lab/**",
        "ios/harness/supervisor.example.json",
        "ios/project/state.json",
        "ios/project/events.jsonl",
        "ios/project/status.md",
        "ios/project/requirements/**",
        "ios/project/approvals/**",
        "ios/project/business-knowledge/packets/published/**",
        "ios/project/business-knowledge/drivers/published/**",
        "ios/project/business-knowledge/coverage/**",
        "ios/project/business-knowledge/releases/**",
        "ios/project/work-item-proposals/**",
        "ios/docs/**"
      ],
      "max_changed_lines": 1100,
      "max_files_changed": 6
    },
    "source_lab": {
      "behaviors": [],
      "mode": "not_applicable",
      "none_reason": "本项不修改或运行 SourceLab",
      "scenarios": []
    },
    "stop_on": [
      "doctor_red",
      "scope_violation",
      "authority_escalation",
      "same_failure_twice",
      "budget_exhausted"
    ]
  }
}
