{
  "api_version": "legado.harness/v1",
  "kind": "WorkItem",
  "metadata": {
    "annotations": {},
    "id": "IOS-GITHUB-GOLDEN-DISPATCHER-001",
    "labels": [
      "phase-0",
      "control-plane",
      "external-execution",
      "android-oracle",
      "golden-dispatcher",
      "corrective"
    ],
    "priority": 100,
    "risk": "high",
    "title": "实现 Golden 外部执行与结果回收"
  },
  "spec": {
    "acceptance": {
      "criteria": [
        {
          "id": "AC-1",
          "knowledge_claims": [],
          "requirement_clauses": [],
          "statement": "Dispatcher identity 绑定 repository/workflow/scenario/current request SHA/committed Receipt hash，create-only request/result branch 名确定且 remote 冲突 fail closed。",
          "verified_by": [
            "harness-tests"
          ]
        },
        {
          "id": "AC-2",
          "knowledge_claims": [],
          "requirement_clauses": [],
          "statement": "只接受唯一 push Run，状态单调写入 ignored journal；重复 run、branch/head/event/conclusion 漂移均拒绝。",
          "verified_by": [
            "harness-tests"
          ]
        },
        {
          "id": "AC-3",
          "knowledge_claims": [],
          "requirement_clauses": [],
          "statement": "成功 Run 必须有唯一未过期 result artifact，SHA256SUMS 与 publisher-result 精确；report 必须绑定 request/run/Receipt/result branch/commit。",
          "verified_by": [
            "harness-tests"
          ]
        },
        {
          "id": "AC-4",
          "knowledge_claims": [],
          "requirement_clauses": [],
          "statement": "result commit 必须是 request SHA 唯一子提交，只改 manifest、scenario Golden、run-bound release receipt；三文件摘要、Manifest v2 entry、receipt authority/authorization/controls 全部验证后才允许 ff-only。",
          "verified_by": [
            "harness-tests"
          ]
        },
        {
          "id": "AC-5",
          "knowledge_claims": [],
          "requirement_clauses": [],
          "statement": "Supervisor drive 在 external_publisher_required 且 github_golden enabled 时调用 Dispatcher；settled 后重新 inspect 并返回 continuation state，不调用普通 Agent。",
          "verified_by": [
            "harness-tests"
          ]
        },
        {
          "id": "AC-6",
          "knowledge_claims": [],
          "requirement_clauses": [],
          "statement": "CAP-KNOWLEDGE-CONTROL revision 71→72，example 默认启用当前 repo 的 Golden 自动发布；本 WorkItem 不访问 GitHub、不创建真实 branch、不修改当前 Golden。",
          "verified_by": [
            "memory-close"
          ]
        }
      ],
      "required_checks": [
        "dependency-policy",
        "harness-tests"
      ]
    },
    "architecture_refs": [
      "ARCH-014",
      "ARCH-017",
      "ADR-0002",
      "ADR-0004"
    ],
    "baseline_checks": [
      "dependency-policy",
      "harness-tests"
    ],
    "budget": {
      "max_edit_verify_cycles": 6,
      "max_full_test_runs": 5,
      "max_infra_retries": 1,
      "max_targeted_test_runs": 32,
      "wall_clock_seconds": 18000
    },
    "capability": "CAP-KNOWLEDGE-CONTROL",
    "completion_effects": {
      "health": {
        "github_golden_dispatcher": "result_verified_ff_v1",
        "loop_external_publisher": "automatic_v1"
      }
    },
    "depends_on": [
      "IOS-GITHUB-GOLDEN-DISPATCHER-SCOPE-001"
    ],
    "gates": [],
    "inputs": {
      "android_source_anchors": [],
      "context_files": [
        "ios/harness/github_oracle_dispatcher.py",
        "ios/harness/github_oracle_receipt.py",
        "ios/harness/loop_supervisor.py",
        "ios/harness/supervisor.example.json",
        ".github/workflows/android-golden-publisher.yml",
        "ios/project/external-execution-receipts/android-oracle-sl-post-form-001-faa7252c34dac546b65c618a52826e6fd42258c5-30403665320-1.json",
        "ios/project/checkpoints/IOS-GITHUB-GOLDEN-DISPATCHER-SCOPE-001.json"
      ],
      "fixtures": []
    },
    "intent": "实现 GitHubGoldenPublisherDispatcher。identity 绑定 repository、固定 Golden workflow、scenario、当前 HEAD request SHA、committed Receipt path/hash 与 remote；request branch 为 feature/golden-<scenario>-<request-sha>，result branch 为 golden/result-<scenario>-<request-sha>。preflight 要求 clean HEAD、remote repo、gh auth、Receipt 普通文件且摘要/verified_candidate/scenario/next_authority 正确。create-only push 后只接受唯一 push Run并单调 journal。成功 Run 下载唯一 android-golden-result-<scenario>-<run>-<attempt> artifact，验证文件集合/SHA256SUMS/report 全绑定；fetch result ref 后验证 remote SHA、单父=request SHA、精确三文件 delta、report digests、Manifest schema v2 fixture entry、release receipt protected_android_golden + github_actions_push_v2 + controls，再次检查 HEAD/clean 后 git merge --ff-only。Supervisor external_publisher_required 在 config external_execution.github_golden.enabled=true 时调用；settled 后重新 inspect 返回 continuation_decision，其他 outcome 不调用 Agent。example 固定当前 repository/origin 并启用 Golden 自动发布。实现与测试不得访问真实 GitHub或修改当前 Golden。CAP-KNOWLEDGE-CONTROL revision 71→72。",
    "knowledge": {
      "claim_refs": [],
      "context_budget": {
        "max_bytes": 49152,
        "max_claims": 12
      },
      "contract_version": 1,
      "coverage_refs": [],
      "driver_refs": [],
      "expected_ledger_transitions": [],
      "mode": "not_applicable",
      "none_reason": "本项只实现 Golden 外部执行适配层",
      "produces": []
    },
    "memory": {
      "adr": "not_required",
      "capability_state_required": true,
      "checkpoint_required": true,
      "pitfall": "required"
    },
    "requirements": {
      "mode": "control_plane",
      "none_reason": "本项只实现外部 Golden 结果回收控制面",
      "refs": []
    },
    "scope": {
      "allow_write": [
        "ios/harness/github_golden_publisher.py",
        "ios/harness/tests/test_github_golden_publisher.py",
        "ios/harness/loop_supervisor.py",
        "ios/harness/tests/test_loop_supervisor.py",
        "ios/harness/supervisor.example.json",
        "ios/harness/README.md",
        "ios/project/capabilities/CAP-KNOWLEDGE-CONTROL.json",
        "ios/project/checkpoints/IOS-GITHUB-GOLDEN-DISPATCHER-001.json",
        "ios/project/pitfalls/PIT-*.json"
      ],
      "deny_write": [
        ".github/**",
        "app/**",
        "modules/**",
        "ios/Packages/**",
        "ios/publisher/**",
        "ios/harness/harness.py",
        "ios/harness/demand_compiler.py",
        "ios/harness/github_oracle_dispatcher.py",
        "ios/harness/github_oracle_receipt.py",
        "ios/harness/proposal_compiler.py",
        "ios/harness/config.json",
        "ios/harness/schemas/**",
        "ios/harness/business-knowledge/**",
        "ios/harness/android-intake/**",
        "ios/harness/source-lab/**",
        "ios/harness/fixtures/**",
        "ios/harness/goldens/**",
        "ios/harness/normalization/**",
        "ios/harness/oracle/**",
        "ios/project/external-execution-receipts/**",
        "ios/project/android-intake/**",
        "ios/project/requirements/**",
        "ios/project/business-knowledge/**",
        "ios/project/approvals/**",
        "ios/project/work-item-proposals/**",
        "ios/project/baseline.json",
        "ios/docs/**"
      ],
      "max_changed_lines": 4800,
      "max_files_changed": 12
    },
    "source_lab": {
      "behaviors": [],
      "mode": "not_applicable",
      "none_reason": "本项只实现外部执行适配层",
      "scenarios": []
    },
    "stop_on": [
      "doctor_red",
      "scope_violation",
      "authority_scope",
      "same_failure_twice",
      "budget_exhausted"
    ]
  }
}
