{
  "api_version": "legado.harness/v1",
  "kind": "WorkItem",
  "metadata": {
    "id": "IOS-KNOWLEDGE-READER-LIFECYCLE-001",
    "title": "提取阅读会话、正文、进度与预取知识",
    "priority": 88,
    "risk": "high",
    "labels": ["phase-2", "knowledge", "android-scan", "reader", "architecture-driver"]
  },
  "spec": {
    "capability": "CAP-KNOWLEDGE-CONTROL",
    "intent": "从冻结 Android baseline 提取阅读会话生命周期、正文获取与归一化、目录/章节切换、排版投影、阅读进度、预取缓存、朗读联动、换源和迟到异步结果等业务知识，形成 Reader Lifecycle Packet 与 Architecture Driver candidate；区分稳定业务合同、Android 平台/UI 细节、风险异常和仍需运行特征化的行为，不修改 Swift 产品代码，不把 Android Activity、Service、Coroutine scope 或三章缓存实现直接复制为 iOS 架构。",
    "depends_on": [
      "IOS-KNOWLEDGE-ANDROID-SURFACES-001",
      "IOS-KNOWLEDGE-BOOK-DOMAIN-001",
      "IOS-KNOWLEDGE-SOURCE-RUNTIME-001"
    ],
    "scope": {
      "allow_write": [
        "ios/project/business-knowledge/packets/proposals/BKP-READER-LIFECYCLE-001/r0001.json",
        "ios/project/business-knowledge/drivers/proposals/DRV-READER-LIFECYCLE-001/r0001.json",
        "ios/project/capabilities/CAP-KNOWLEDGE-CONTROL.json",
        "ios/project/checkpoints/IOS-KNOWLEDGE-READER-LIFECYCLE-001.json",
        "ios/project/pitfalls/PIT-*.json"
      ],
      "deny_write": [
        "app/**",
        "modules/**",
        "ios/Packages/**",
        "ios/harness/business-knowledge/**",
        "ios/harness/tests/**",
        "ios/harness/fixtures/**",
        "ios/harness/source-lab/**",
        "ios/harness/oracle/**",
        "ios/project/android-intake/**",
        "ios/project/business-knowledge/packets/published/**",
        "ios/project/business-knowledge/drivers/published/**",
        "ios/project/business-knowledge/coverage/**",
        "ios/project/business-knowledge/packets/proposals/BKP-ANDROID-SURFACES-001/**",
        "ios/project/business-knowledge/packets/proposals/BKP-BOOK-DOMAIN-001/**",
        "ios/project/business-knowledge/packets/proposals/BKP-SOURCE-RUNTIME-001/**",
        "ios/project/requirements/**",
        "ios/project/requirement-proposals/**",
        "ios/project/work-item-proposals/**",
        "ios/project/baseline.json",
        "ios/project/approvals/**",
        "ios/docs/**"
      ],
      "max_files_changed": 5,
      "max_changed_lines": 3000
    },
    "inputs": {
      "context_files": [
        "ios/docs/android-requirement-intake.md",
        "ios/docs/business-knowledge-control-plane.md",
        "ios/docs/architecture.md",
        "ios/docs/testing-and-conformance.md",
        "ios/project/android-intake/inventory-manifest.json",
        "ios/project/business-knowledge/catalog.json",
        "ios/project/business-knowledge/packets/proposals/BKP-ANDROID-SURFACES-001/r0001.json",
        "ios/project/business-knowledge/packets/proposals/BKP-BOOK-DOMAIN-001/r0001.json",
        "ios/project/business-knowledge/packets/proposals/BKP-SOURCE-RUNTIME-001/r0001.json",
        "ios/project/work-item-proposals/initialization-dag.json"
      ],
      "android_source_anchors": [
        "app/src/main/java/io/legado/app/model/ReadBook.kt",
        "app/src/main/java/io/legado/app/ui/book/read/ReadBookViewModel.kt",
        "app/src/main/java/io/legado/app/ui/book/read/ReadBookActivity.kt",
        "app/src/main/java/io/legado/app/ui/book/read/BaseReadBookActivity.kt",
        "app/src/main/java/io/legado/app/ui/book/read/page/entities/TextChapter.kt",
        "app/src/main/java/io/legado/app/help/book/BookHelp.kt",
        "app/src/main/java/io/legado/app/model/CacheBook.kt",
        "app/src/main/java/io/legado/app/service/CacheBookService.kt",
        "app/src/main/java/io/legado/app/data/entities/Book.kt",
        "app/src/main/java/io/legado/app/data/entities/BookChapter.kt",
        "app/src/main/java/io/legado/app/data/entities/BookProgress.kt",
        "app/src/main/java/io/legado/app/data/entities/ReadRecord.kt"
      ],
      "fixtures": []
    },
    "architecture_refs": ["ARCH-006", "ARCH-008", "ARCH-009", "ARCH-017", "ARCH-018", "ADR-0004"],
    "acceptance": {
      "criteria": [
        {
          "id": "AC-1",
          "statement": "Packet candidate 给出从打开书籍、恢复位置、获取/归一化正文、排版、ready、切章、关闭到异常恢复的阅读会话状态与数据流，并明确 Book、Chapter、Source 与 Reader 的职责边界。",
          "verified_by": ["android-intake-contract", "harness-tests"],
          "requirement_clauses": [],
          "knowledge_claims": []
        },
        {
          "id": "AC-2",
          "statement": "进度主张区分章节身份、字符/语义位置、页码投影、音频位置、保存时机、目录变化重映射和跨设备同步；无法由源码确定的首尾页、重排、崩溃恢复与冲突行为保持 android_characterization。",
          "verified_by": ["android-intake-contract", "harness-tests"],
          "requirement_clauses": [],
          "knowledge_claims": []
        },
        {
          "id": "AC-3",
          "statement": "并发主张覆盖切章 generation、正文请求、排版、预取、缓存、朗读和换源产生的迟到结果、取消与隔离风险；不得把 Coroutine/Service/Activity 生命周期直接当作跨端合同。",
          "verified_by": ["dependency-policy", "harness-tests"],
          "requirement_clauses": [],
          "knowledge_claims": []
        },
        {
          "id": "AC-4",
          "statement": "缓存主张区分 acquisition、normalized document、layout projection、progress 与 image 等层次，记录 key、所有者、可重建性和失效条件；Android 三章窗口只能作为可替换策略候选。",
          "verified_by": ["android-intake-contract", "harness-tests"],
          "requirement_clauses": [],
          "knowledge_claims": []
        },
        {
          "id": "AC-5",
          "statement": "DRV-READER-LIFECYCLE-001 引用本批或已存在候选 Claim，提出 ReaderKit 独立边界、ReaderSession 生命周期、typed cursor、generation/revision、内容提供协议、缓存分层、可测试性和可观察性决策问题，保持 proposed 且不生成 accepted ADR。",
          "verified_by": ["dependency-policy", "harness-tests"],
          "requirement_clauses": [],
          "knowledge_claims": []
        },
        {
          "id": "AC-6",
          "statement": "每条 Claim 绑定冻结 commit 的真实源码锚点或精确候选引用；Checkpoint 记录所需 Android characterization、与 Source/Book/UI 的后续依赖以及 ADR 问题，Capability 保持 partial。",
          "verified_by": ["android-intake-contract", "memory-close"],
          "requirement_clauses": [],
          "knowledge_claims": []
        }
      ],
      "required_checks": [
        "android-intake-contract",
        "dependency-policy",
        "harness-tests"
      ]
    },
    "baseline_checks": ["android-intake-contract", "harness-tests"],
    "budget": {
      "wall_clock_seconds": 7200,
      "max_edit_verify_cycles": 3,
      "max_targeted_test_runs": 5,
      "max_full_test_runs": 2,
      "max_infra_retries": 1
    },
    "gates": [],
    "completion_effects": {
      "health": {
        "knowledge_reader_lifecycle": "candidate_verified"
      }
    },
    "memory": {
      "capability_state_required": true,
      "compatibility": "not_applicable",
      "pitfall": "if_non_obvious_and_preventable",
      "adr": "required_for_architecture_change"
    },
    "requirements": {
      "mode": "control_plane",
      "refs": [],
      "none_reason": "本项只生产 Reader 业务知识与 Architecture Driver 候选，不接受或实现产品行为"
    },
    "knowledge": {
      "contract_version": 1,
      "mode": "produce",
      "claim_refs": [],
      "driver_refs": [],
      "coverage_refs": [],
      "produces": [
        {
          "kind": "packet",
          "id": "BKP-READER-LIFECYCLE-001",
          "revision": 1
        },
        {
          "kind": "driver",
          "id": "DRV-READER-LIFECYCLE-001",
          "revision": 1
        }
      ],
      "expected_ledger_transitions": [],
      "context_budget": {
        "max_claims": 40,
        "max_bytes": 65536
      },
      "none_reason": null
    },
    "source_lab": {
      "mode": "not_applicable",
      "behaviors": [],
      "scenarios": [],
      "none_reason": "本项只扫描 Android Reader 行为，不执行书源、Android runner、模拟器或 Swift Reader"
    },
    "stop_on": [
      "baseline_red",
      "scope_violation",
      "authority_escalation",
      "knowledge_drift",
      "same_failure_twice",
      "budget_exhausted",
      "human_decision_required"
    ]
  }
}
