{
  "api_version": "legado.harness/v1",
  "kind": "WorkItem",
  "metadata": {
    "annotations": {},
    "id": "IOS-GITHUB-GOLDEN-PUBLISHER-AUTOMATION-001",
    "labels": [
      "phase-0",
      "control-plane",
      "external-execution",
      "android-oracle",
      "golden-publisher",
      "corrective"
    ],
    "priority": 100,
    "risk": "high",
    "title": "实现无人工 Gate 的场景化 Golden Publisher"
  },
  "spec": {
    "acceptance": {
      "criteria": [
        {
          "id": "AC-1",
          "knowledge_claims": [],
          "requirement_clauses": [],
          "statement": "staging-only publisher 必须接受显式 scenario，调用 trusted_import.verify(...scenario_id=)，读取 scenario-specific archive members，并拒绝 fixture/path/payload/run/source/proposal 任一漂移。",
          "verified_by": [
            "harness-tests"
          ]
        },
        {
          "id": "AC-2",
          "knowledge_claims": [],
          "requirement_clauses": [],
          "statement": "输出 Golden manifest schema v2，把 runner_digest、runner_image_digest、android_git_commit、profile、canonicalizer_sha256、authorization 下沉到每个 fixture；已有 schema v1 entry 确定性迁移且不要求不同场景共享 Runner。",
          "verified_by": [
            "harness-tests"
          ]
        },
        {
          "id": "AC-3",
          "knowledge_claims": [],
          "requirement_clauses": [],
          "statement": "workflow 只由 feature/golden-<scenario>-<exact-sha> create-only push 触发，从 committed verified-candidate Receipt 获取唯一 Oracle run/artifact，验证 branch/head/Receipt/Run/Artifact 后调用 historical Oracle source 上的 Publisher。",
          "verified_by": [
            "harness-tests",
            "dependency-policy"
          ]
        },
        {
          "id": "AC-4",
          "knowledge_claims": [],
          "requirement_clauses": [],
          "statement": "workflow 不使用 Environment、workflow_dispatch、PR 或人工 Gate；只向 golden/result-<scenario>-<request-sha> create-only branch 写一个父提交，并上传绑定 result commit/manifest/receipt/golden digest 的确定性 result artifact。",
          "verified_by": [
            "harness-tests",
            "dependency-policy"
          ]
        },
        {
          "id": "AC-5",
          "knowledge_claims": [],
          "requirement_clauses": [],
          "statement": "Publisher 重放同一已发布 fixture 时只接受字节完全相同并返回 already_published；冲突发布 fail closed。输出目录仍必须在仓库外且只包含 manifest/payload/release receipt。",
          "verified_by": [
            "harness-tests"
          ]
        },
        {
          "id": "AC-6",
          "knowledge_claims": [],
          "requirement_clauses": [],
          "statement": "CAP-CONFORMANCE revision 23→24，Checkpoint/Pitfall 记录协议迁移；本 WorkItem 不修改当前 ios/harness/goldens/**、不访问 GitHub、不创建远端分支或真实 Golden。",
          "verified_by": [
            "memory-close"
          ]
        }
      ],
      "required_checks": [
        "dependency-policy",
        "harness-tests"
      ]
    },
    "architecture_refs": [
      "ARCH-014",
      "ARCH-017",
      "ADR-0002",
      "ADR-0004"
    ],
    "baseline_checks": [
      "dependency-policy",
      "harness-tests"
    ],
    "budget": {
      "max_edit_verify_cycles": 6,
      "max_full_test_runs": 5,
      "max_infra_retries": 1,
      "max_targeted_test_runs": 30,
      "wall_clock_seconds": 18000
    },
    "capability": "CAP-CONFORMANCE",
    "completion_effects": {
      "health": {
        "android_golden_publisher": "scenario_aware_push_v2"
      }
    },
    "depends_on": [
      "IOS-GITHUB-GOLDEN-PUBLISHER-SCOPE-001"
    ],
    "gates": [],
    "inputs": {
      "android_source_anchors": [],
      "context_files": [
        ".github/workflows/android-golden-publisher.yml",
        ".github/workflows/android-oracle-attestation.yml",
        "ios/publisher/android_golden_publisher.py",
        "ios/harness/tests/test_android_golden_publisher.py",
        "ios/harness/oracle/ci_proposal.py",
        "ios/harness/oracle/trusted_import.py",
        "ios/harness/goldens/manifest.json",
        "ios/project/external-execution-receipts/android-oracle-sl-post-form-001-faa7252c34dac546b65c618a52826e6fd42258c5-30403665320-1.json",
        "ios/project/checkpoints/IOS-GITHUB-GOLDEN-PUBLISHER-SCOPE-001.json"
      ],
      "fixtures": []
    },
    "intent": "把旧的单场景、workflow_dispatch、Environment、PR Golden Publisher 替换为无人工 Gate 的 create-only branch push 协议。Publisher 新增 --scenario，传入 trusted_import scenario_id，使用 ci_proposal.expected_*_members(scenario)，按 proposal fixture 自动计算路径。输出 manifest schema v2：保留顶层 oracle.android_git_commit/profile 与 canonicalizer_sha256 作为 baseline compatibility，同时每个 fixture 完整绑定 android_git_commit/profile/runner_digest/runner_image_digest/canonicalizer_sha256/authorization；旧 schema v1 entry 从顶层字段确定性迁移。相同 fixture 的完全相同发布为幂等 already_published，任何字段/字节冲突拒绝。Workflow 监听 feature/golden-<scenario>-<40hex> push，要求 branch SHA=GITHUB_SHA，读取唯一 committed verified-candidate Receipt，验证 Receipt source/run/artifact 与 GitHub API，checkout historical Oracle source，下载并校验 exact artifact，运行 Publisher，将三个输出提交为 GITHUB_SHA 的唯一子提交到 create-only golden/result-<scenario>-<GITHUB_SHA>，并上传只含 publisher-result.json/SHA256SUMS 的 run-bound artifact。移除 Environment、workflow_dispatch、pull-request 权限与 gh pr create。本项不修改当前 Golden、不运行网络。CAP-CONFORMANCE revision 23→24。",
    "knowledge": {
      "claim_refs": [],
      "context_budget": {
        "max_bytes": 49152,
        "max_claims": 12
      },
      "contract_version": 1,
      "coverage_refs": [],
      "driver_refs": [],
      "expected_ledger_transitions": [],
      "mode": "not_applicable",
      "none_reason": "本项只实现 Golden 发布控制协议",
      "produces": []
    },
    "memory": {
      "adr": "not_required",
      "capability_state_required": true,
      "checkpoint_required": true,
      "pitfall": "required"
    },
    "requirements": {
      "mode": "control_plane",
      "none_reason": "本项只实现外部 Golden 发布控制面",
      "refs": []
    },
    "scope": {
      "allow_write": [
        ".github/workflows/android-golden-publisher.yml",
        "ios/publisher/android_golden_publisher.py",
        "ios/publisher/README.md",
        "ios/harness/tests/test_android_golden_publisher.py",
        "ios/project/capabilities/CAP-CONFORMANCE.json",
        "ios/project/checkpoints/IOS-GITHUB-GOLDEN-PUBLISHER-AUTOMATION-001.json",
        "ios/project/pitfalls/PIT-*.json"
      ],
      "deny_write": [
        ".github/workflows/android-oracle-attestation.yml",
        ".github/workflows/change.yml",
        "app/**",
        "modules/**",
        "ios/Packages/**",
        "ios/harness/harness.py",
        "ios/harness/demand_compiler.py",
        "ios/harness/loop_supervisor.py",
        "ios/harness/github_golden_publisher.py",
        "ios/harness/github_oracle_dispatcher.py",
        "ios/harness/github_oracle_receipt.py",
        "ios/harness/proposal_compiler.py",
        "ios/harness/config.json",
        "ios/harness/schemas/**",
        "ios/harness/business-knowledge/**",
        "ios/harness/android-intake/**",
        "ios/harness/source-lab/**",
        "ios/harness/fixtures/**",
        "ios/harness/goldens/**",
        "ios/harness/normalization/**",
        "ios/harness/oracle/**",
        "ios/project/external-execution-receipts/**",
        "ios/project/android-intake/**",
        "ios/project/requirements/**",
        "ios/project/business-knowledge/**",
        "ios/project/approvals/**",
        "ios/project/work-item-proposals/**",
        "ios/project/baseline.json",
        "ios/docs/**"
      ],
      "max_changed_lines": 4200,
      "max_files_changed": 9
    },
    "source_lab": {
      "behaviors": [],
      "mode": "not_applicable",
      "none_reason": "本项只实现 Publisher，不运行 SourceLab",
      "scenarios": []
    },
    "stop_on": [
      "doctor_red",
      "scope_violation",
      "authority_scope",
      "same_failure_twice",
      "budget_exhausted"
    ]
  }
}
