{
  "api_version": "legado.harness/v1",
  "kind": "WorkItem",
  "metadata": {
    "id": "IOS-REQUIREMENT-READINESS-PUBLISHER-001",
    "title": "建立受信 Requirement Readiness Publisher",
    "priority": 100,
    "risk": "critical",
    "labels": [
      "phase-0",
      "control-plane",
      "requirement",
      "trusted-publisher",
      "github-actions"
    ]
  },
  "spec": {
    "capability": "CAP-KNOWLEDGE-CONTROL",
    "intent": "建立独立、staging-only 的 Requirement Readiness Publisher。它只能在 GitHub Environment 授权下，把 REQ-ANDROID-SOURCE-PIPELINE-001@1 从 characterization_required 提升为 implementation_ready；输入必须精确绑定当前 Requirement record/catalog、protected sl-html-basic-001 Golden receipt、受信 Business Knowledge release 与完整 Coverage ledger。Publisher 生成更新后的 Requirement、Catalog 和不可变 release receipt，先冻结本地 commit，再由 Harness doctor、Business Knowledge doctor 与 Demand Compiler 证明下一状态为 blueprint_required；全部通过后才 push PR。不得由本地 Agent 直接修改 Requirement authority。",
    "depends_on": [
      "IOS-BUSINESS-KNOWLEDGE-PUBLISHER-PLAN-006"
    ],
    "scope": {
      "allow_write": [
        "ios/publisher/requirement_readiness_publisher.py",
        ".github/workflows/requirement-readiness-publisher.yml",
        "ios/harness/tests/test_requirement_readiness_publisher.py",
        "ios/project/capabilities/CAP-KNOWLEDGE-CONTROL.json",
        "ios/project/checkpoints/IOS-REQUIREMENT-READINESS-PUBLISHER-001.json",
        "ios/project/pitfalls/PIT-*.json"
      ],
      "deny_write": [
        "app/**",
        "modules/**",
        "ios/Packages/**",
        "ios/harness/demand_compiler.py",
        "ios/harness/business-knowledge/**",
        "ios/harness/goldens/**",
        "ios/project/business-knowledge/**",
        "ios/project/requirements/**",
        "ios/project/approvals/**",
        "ios/project/baseline.json",
        "ios/docs/**"
      ],
      "max_files_changed": 6,
      "max_changed_lines": 1800
    },
    "inputs": {
      "context_files": [
        "ios/project/requirements/accepted/REQ-ANDROID-SOURCE-PIPELINE-001.json",
        "ios/project/requirements/catalog.json",
        "ios/harness/goldens/releases/sl-html-basic-001-30355913470-1.json",
        "ios/project/business-knowledge/releases/BKP-SOURCE-RUNTIME-HTML-CSS-001-r0001-30371606142-1.json",
        "ios/project/business-knowledge/coverage/BKL-SOURCE-RUNTIME-HTML-CSS-001.json",
        "ios/publisher/business_knowledge_publisher.py",
        ".github/workflows/business-knowledge-publisher.yml"
      ],
      "android_source_anchors": [],
      "fixtures": [
        "sl-html-basic-001"
      ]
    },
    "architecture_refs": [
      "ARCH-014",
      "ADR-0004"
    ],
    "acceptance": {
      "criteria": [
        {
          "id": "AC-1",
          "statement": "Publisher 对 source commit、actor、branch、原 Requirement/Catalog、protected Golden、Business Knowledge release 与 Coverage 原始摘要逐一精确绑定。",
          "verified_by": [
            "harness-tests"
          ],
          "requirement_clauses": [],
          "knowledge_claims": []
        },
        {
          "id": "AC-2",
          "statement": "只有四条 RC 均被 runtime_verified knowledge/Coverage 与 protected Golden 覆盖时，才生成 implementation_ready Requirement、同步 Catalog 和 release receipt。",
          "verified_by": [
            "harness-tests"
          ],
          "requirement_clauses": [],
          "knowledge_claims": []
        },
        {
          "id": "AC-3",
          "statement": "prepare 只写外部 staging 目录；真实 Requirement authority 只能由 Environment workflow 的 PR 落库。",
          "verified_by": [
            "harness-tests",
            "dependency-policy"
          ],
          "requirement_clauses": [],
          "knowledge_claims": []
        },
        {
          "id": "AC-4",
          "statement": "workflow 在不可变本地 commit 上连续通过三个 doctor/compiler，并精确证明下一 Loop 状态为 blueprint_required 后才 push PR。",
          "verified_by": [
            "harness-tests"
          ],
          "requirement_clauses": [],
          "knowledge_claims": []
        },
        {
          "id": "AC-5",
          "statement": "Checkpoint、Capability 与 Pitfall 记录 Requirement readiness authority、回滚与后续 blueprint 风险。",
          "verified_by": [
            "memory-close"
          ],
          "requirement_clauses": [],
          "knowledge_claims": []
        }
      ],
      "required_checks": [
        "dependency-policy",
        "harness-tests"
      ]
    },
    "baseline_checks": [
      "dependency-policy",
      "harness-tests"
    ],
    "budget": {
      "wall_clock_seconds": 14400,
      "max_edit_verify_cycles": 5,
      "max_targeted_test_runs": 24,
      "max_full_test_runs": 4,
      "max_infra_retries": 3
    },
    "gates": [],
    "completion_effects": {
      "health": {
        "requirement_readiness_publisher": "implemented_external_authority"
      }
    },
    "memory": {
      "capability_state_required": true,
      "checkpoint_required": true,
      "pitfall_update_required": true,
      "adr": "not_required"
    },
    "requirements": {
      "mode": "control_plane",
      "refs": [],
      "none_reason": "本项实现 Requirement authority Publisher，不在本地提升产品 Requirement"
    },
    "knowledge": {
      "contract_version": 1,
      "mode": "not_applicable",
      "claim_refs": [],
      "driver_refs": [],
      "coverage_refs": [],
      "produces": [],
      "expected_ledger_transitions": [],
      "context_budget": {
        "max_claims": 8,
        "max_bytes": 32768
      },
      "none_reason": "本项只消费已发布知识作为外部 Publisher 输入，不由本地 Work Item 选择知识"
    },
    "source_lab": {
      "mode": "not_applicable",
      "behaviors": [],
      "scenarios": [],
      "none_reason": "本项不生成新 Golden 或 SourceLab 行为"
    },
    "stop_on": [
      "baseline_red",
      "scope_violation",
      "authority_escalation",
      "same_failure_twice",
      "budget_exhausted",
      "human_decision_required"
    ]
  }
}
